05:54:49.601457 arp who-has 10.0.1.12 tell 10.0.1.11
05:54:49.601547 arp reply 10.0.1.12 is-at 00:04:5a:7a:c8:ca
05:54:49.601560 IP 10.0.1.11 > 10.0.1.12: ICMP echo request, id 8516, seq 1, length 64
05:54:49.601649 IP 10.0.1.12 > 10.0.1.11: ICMP echo reply, id 8516, seq 1, length 64
05:54:50.601335 IP 10.0.1.11 > 10.0.1.12: ICMP echo request, id 8516, seq 2, length 64
05:54:50.601427 IP 10.0.1.12 > 10.0.1.11: ICMP echo reply, id 8516, seq 2, length 64
05:54:51.601200 IP 10.0.1.11 > 10.0.1.12: ICMP echo request, id 8516, seq 3, length 64
05:54:51.601290 IP 10.0.1.12 > 10.0.1.11: ICMP echo reply, id 8516, seq 3, length 64
05:54:52.601062 IP 10.0.1.11 > 10.0.1.12: ICMP echo request, id 8516, seq 4, length 64
05:54:52.601153 IP 10.0.1.12 > 10.0.1.11: ICMP echo reply, id 8516, seq 4, length 64
05:54:53.600926 IP 10.0.1.11 > 10.0.1.12: ICMP echo request, id 8516, seq 5, length 64
05:54:53.601014 IP 10.0.1.12 > 10.0.1.11: ICMP echo reply, id 8516, seq 5, length 64
05:54:54.599346 arp who-has 10.0.1.11 tell 10.0.1.12
05:54:54.599365 arp reply 10.0.1.11 is-at 00:04:5a:7a:c8:25

