06:09:10.967501 IP 10.0.1.11 > 10.0.1.12: ICMP echo request, id 19524, seq 1, length 64
06:09:10.967590 IP 10.0.1.12 > 10.0.1.11: ICMP echo reply, id 19524, seq 1, length 64
06:09:11.963288 IP 10.0.1.11 > 10.0.1.12: ICMP echo request, id 19524, seq 2, length 64
06:09:11.963381 IP 10.0.1.12 > 10.0.1.11: ICMP echo reply, id 19524, seq 2, length 64
06:09:12.963153 IP 10.0.1.11 > 10.0.1.12: ICMP echo request, id 19524, seq 3, length 64
06:09:12.963242 IP 10.0.1.12 > 10.0.1.11: ICMP echo reply, id 19524, seq 3, length 64
06:09:13.963016 IP 10.0.1.11 > 10.0.1.12: ICMP echo request, id 19524, seq 4, length 64
06:09:13.963108 IP 10.0.1.12 > 10.0.1.11: ICMP echo reply, id 19524, seq 4, length 64
06:09:14.962878 IP 10.0.1.11 > 10.0.1.12: ICMP echo request, id 19524, seq 5, length 64
06:09:14.962968 IP 10.0.1.12 > 10.0.1.11: ICMP echo reply, id 19524, seq 5, length 64

