04:30:04.807672 IP 10.0.1.11 > 10.0.1.255: ICMP echo request, id 7777, seq 1, length 64
04:30:04.807778 IP 10.0.1.12 > 10.0.1.11: ICMP echo reply, id 7777, seq 1, length 64
04:30:04.810936 arp who-has 10.0.1.11 tell 10.0.1.13
04:30:04.810964 arp reply 10.0.1.11 is-at 00:04:5a:7a:c8:25
04:30:04.811030 IP 10.0.1.13 > 10.0.1.11: ICMP echo reply, id 7777, seq 1, length 64
04:30:04.814185 arp who-has 10.0.1.11 tell 10.0.1.14
04:30:04.814211 arp reply 10.0.1.11 is-at 00:04:5a:7a:c8:25
04:30:04.814276 IP 10.0.1.14 > 10.0.1.11: ICMP echo reply, id 7777, seq 1, length 64
04:30:05.807187 IP 10.0.1.11 > 10.0.1.255: ICMP echo request, id 7777, seq 2, length 64
04:30:05.807274 IP 10.0.1.13 > 10.0.1.11: ICMP echo reply, id 7777, seq 2, length 64
04:30:05.807287 IP 10.0.1.12 > 10.0.1.11: ICMP echo reply, id 7777, seq 2, length 64
04:30:05.807291 IP 10.0.1.14 > 10.0.1.11: ICMP echo reply, id 7777, seq 2, length 64
04:30:09.809004 arp who-has 10.0.1.11 tell 10.0.1.12
04:30:09.809034 arp reply 10.0.1.11 is-at 00:04:5a:7a:c8:25

